{
  "sim_time": "2026-09-04T14:45:00Z",
  "cycle_number": 90,
  "entities": [
    {
      "entity_id": "stadium_main",
      "sim_time": "2026-09-04T14:45:00Z",
      "current_count": 32584.9,
      "utilisation": 0.4655,
      "flow_rate_per_min": 2034.0,
      "risk_score": 28,
      "risk_band": "low",
      "is_observed": true
    },
    {
      "entity_id": "gate_1",
      "sim_time": "2026-09-04T14:45:00Z",
      "current_count": 1186.5,
      "utilisation": 0.4237,
      "flow_rate_per_min": -113.4,
      "risk_score": 34,
      "risk_band": "moderate",
      "is_observed": true
    },
    {
      "entity_id": "gate_2",
      "sim_time": "2026-09-04T14:45:00Z",
      "current_count": 147.8,
      "utilisation": 0.0528,
      "flow_rate_per_min": 4.4,
      "risk_score": 3,
      "risk_band": "low",
      "is_observed": false
    },
    {
      "entity_id": "gate_3",
      "sim_time": "2026-09-04T14:45:00Z",
      "current_count": 1425.8,
      "utilisation": 0.6481,
      "flow_rate_per_min": -56.2,
      "risk_score": 61,
      "risk_band": "high",
      "is_observed": true
    },
    {
      "entity_id": "gate_4",
      "sim_time": "2026-09-04T14:45:00Z",
      "current_count": 1209.6,
      "utilisation": 0.4838,
      "flow_rate_per_min": -3.2,
      "risk_score": 25,
      "risk_band": "low",
      "is_observed": false
    },
    {
      "entity_id": "gate_5",
      "sim_time": "2026-09-04T14:45:00Z",
      "current_count": 1178.3,
      "utilisation": 0.7855,
      "flow_rate_per_min": -7.8,
      "risk_score": 70,
      "risk_band": "high",
      "is_observed": true
    },
    {
      "entity_id": "gate_6",
      "sim_time": "2026-09-04T14:45:00Z",
      "current_count": 1627.1,
      "utilisation": 0.6258,
      "flow_rate_per_min": 38.6,
      "risk_score": 48,
      "risk_band": "moderate",
      "is_observed": true
    },
    {
      "entity_id": "metro_a",
      "sim_time": "2026-09-04T14:45:00Z",
      "current_count": 3255.5,
      "utilisation": 0.8567,
      "flow_rate_per_min": 163.4,
      "risk_score": 53,
      "risk_band": "moderate",
      "is_observed": true
    },
    {
      "entity_id": "metro_b",
      "sim_time": "2026-09-04T14:45:00Z",
      "current_count": 4714.5,
      "utilisation": 1.1225,
      "flow_rate_per_min": -70.0,
      "risk_score": 77,
      "risk_band": "high",
      "is_observed": true
    },
    {
      "entity_id": "metro_c",
      "sim_time": "2026-09-04T14:45:00Z",
      "current_count": 2297.8,
      "utilisation": 0.6383,
      "flow_rate_per_min": -113.5,
      "risk_score": 57,
      "risk_band": "moderate",
      "is_observed": true
    },
    {
      "entity_id": "metro_d",
      "sim_time": "2026-09-04T14:45:00Z",
      "current_count": 3065.3,
      "utilisation": 0.9888,
      "flow_rate_per_min": 92.0,
      "risk_score": 86,
      "risk_band": "critical",
      "is_observed": true
    },
    {
      "entity_id": "metro_e",
      "sim_time": "2026-09-04T14:45:00Z",
      "current_count": 2265.6,
      "utilisation": 0.7813,
      "flow_rate_per_min": 216.9,
      "risk_score": 42,
      "risk_band": "moderate",
      "is_observed": true
    },
    {
      "entity_id": "bus_hub_north",
      "sim_time": "2026-09-04T14:45:00Z",
      "current_count": 1717.8,
      "utilisation": 0.7158,
      "flow_rate_per_min": -98.5,
      "risk_score": 61,
      "risk_band": "high",
      "is_observed": true
    },
    {
      "entity_id": "bus_hub_south",
      "sim_time": "2026-09-04T14:45:00Z",
      "current_count": 1612.0,
      "utilisation": 0.7327,
      "flow_rate_per_min": 7.6,
      "risk_score": 43,
      "risk_band": "moderate",
      "is_observed": true
    },
    {
      "entity_id": "shuttle_hub_east",
      "sim_time": "2026-09-04T14:45:00Z",
      "current_count": 1842.8,
      "utilisation": 1.0238,
      "flow_rate_per_min": 4.9,
      "risk_score": 60,
      "risk_band": "moderate",
      "is_observed": true
    },
    {
      "entity_id": "shuttle_hub_west",
      "sim_time": "2026-09-04T14:45:00Z",
      "current_count": 1772.8,
      "utilisation": 0.9849,
      "flow_rate_per_min": 21.7,
      "risk_score": 64,
      "risk_band": "high",
      "is_observed": true
    },
    {
      "entity_id": "line_blue",
      "sim_time": "2026-09-04T14:45:00Z",
      "current_count": 24148.8,
      "utilisation": 1.0062,
      "flow_rate_per_min": -1274.9,
      "risk_score": 73,
      "risk_band": "high",
      "is_observed": true
    },
    {
      "entity_id": "line_red",
      "sim_time": "2026-09-04T14:45:00Z",
      "current_count": 4294.4,
      "utilisation": 0.2045,
      "flow_rate_per_min": -15.0,
      "risk_score": 10,
      "risk_band": "low",
      "is_observed": false
    },
    {
      "entity_id": "line_green",
      "sim_time": "2026-09-04T14:45:00Z",
      "current_count": 17012.7,
      "utilisation": 1.1342,
      "flow_rate_per_min": 181.6,
      "risk_score": 67,
      "risk_band": "high",
      "is_observed": true
    },
    {
      "entity_id": "road_1",
      "sim_time": "2026-09-04T14:45:00Z",
      "current_count": 648.1,
      "utilisation": 0.5891,
      "flow_rate_per_min": -2.9,
      "risk_score": 39,
      "risk_band": "moderate",
      "is_observed": true
    },
    {
      "entity_id": "road_2",
      "sim_time": "2026-09-04T14:45:00Z",
      "current_count": 697.4,
      "utilisation": 0.6974,
      "flow_rate_per_min": 31.3,
      "risk_score": 64,
      "risk_band": "high",
      "is_observed": true
    },
    {
      "entity_id": "road_3",
      "sim_time": "2026-09-04T14:45:00Z",
      "current_count": 648.6,
      "utilisation": 0.6827,
      "flow_rate_per_min": 35.6,
      "risk_score": 45,
      "risk_band": "moderate",
      "is_observed": true
    },
    {
      "entity_id": "road_4",
      "sim_time": "2026-09-04T14:45:00Z",
      "current_count": 420.7,
      "utilisation": 0.4675,
      "flow_rate_per_min": 21.8,
      "risk_score": 40,
      "risk_band": "moderate",
      "is_observed": true
    },
    {
      "entity_id": "road_5",
      "sim_time": "2026-09-04T14:45:00Z",
      "current_count": 736.9,
      "utilisation": 0.7369,
      "flow_rate_per_min": 27.6,
      "risk_score": 49,
      "risk_band": "moderate",
      "is_observed": true
    },
    {
      "entity_id": "road_6",
      "sim_time": "2026-09-04T14:45:00Z",
      "current_count": 583.5,
      "utilisation": 0.5557,
      "flow_rate_per_min": -2.6,
      "risk_score": 40,
      "risk_band": "moderate",
      "is_observed": false
    },
    {
      "entity_id": "road_7",
      "sim_time": "2026-09-04T14:45:00Z",
      "current_count": 186.8,
      "utilisation": 0.2197,
      "flow_rate_per_min": 8.1,
      "risk_score": 18,
      "risk_band": "low",
      "is_observed": false
    },
    {
      "entity_id": "road_8",
      "sim_time": "2026-09-04T14:45:00Z",
      "current_count": 496.7,
      "utilisation": 0.5518,
      "flow_rate_per_min": 27.5,
      "risk_score": 31,
      "risk_band": "moderate",
      "is_observed": true
    },
    {
      "entity_id": "road_9",
      "sim_time": "2026-09-04T14:45:00Z",
      "current_count": 856.4,
      "utilisation": 1.098,
      "flow_rate_per_min": 8.7,
      "risk_score": 56,
      "risk_band": "moderate",
      "is_observed": false
    },
    {
      "entity_id": "road_10",
      "sim_time": "2026-09-04T14:45:00Z",
      "current_count": 437.6,
      "utilisation": 0.5337,
      "flow_rate_per_min": 23.2,
      "risk_score": 28,
      "risk_band": "low",
      "is_observed": true
    },
    {
      "entity_id": "road_11",
      "sim_time": "2026-09-04T14:45:00Z",
      "current_count": 310.5,
      "utilisation": 0.4196,
      "flow_rate_per_min": 9.5,
      "risk_score": 22,
      "risk_band": "low",
      "is_observed": true
    },
    {
      "entity_id": "road_12",
      "sim_time": "2026-09-04T14:45:00Z",
      "current_count": 336.4,
      "utilisation": 0.4546,
      "flow_rate_per_min": -0.7,
      "risk_score": 31,
      "risk_band": "moderate",
      "is_observed": true
    },
    {
      "entity_id": "road_13",
      "sim_time": "2026-09-04T14:45:00Z",
      "current_count": 27.9,
      "utilisation": 0.0399,
      "flow_rate_per_min": -9.1,
      "risk_score": 2,
      "risk_band": "low",
      "is_observed": false
    },
    {
      "entity_id": "road_14",
      "sim_time": "2026-09-04T14:45:00Z",
      "current_count": 414.4,
      "utilisation": 0.592,
      "flow_rate_per_min": -1.8,
      "risk_score": 32,
      "risk_band": "moderate",
      "is_observed": true
    },
    {
      "entity_id": "road_15",
      "sim_time": "2026-09-04T14:45:00Z",
      "current_count": 468.7,
      "utilisation": 0.7101,
      "flow_rate_per_min": -33.3,
      "risk_score": 40,
      "risk_band": "moderate",
      "is_observed": true
    },
    {
      "entity_id": "road_16",
      "sim_time": "2026-09-04T14:45:00Z",
      "current_count": 311.1,
      "utilisation": 0.4713,
      "flow_rate_per_min": -33.7,
      "risk_score": 37,
      "risk_band": "moderate",
      "is_observed": true
    },
    {
      "entity_id": "road_17",
      "sim_time": "2026-09-04T14:45:00Z",
      "current_count": 461.1,
      "utilisation": 0.5911,
      "flow_rate_per_min": -8.9,
      "risk_score": 30,
      "risk_band": "low",
      "is_observed": true
    },
    {
      "entity_id": "road_18",
      "sim_time": "2026-09-04T14:45:00Z",
      "current_count": 457.1,
      "utilisation": 0.586,
      "flow_rate_per_min": 51.0,
      "risk_score": 46,
      "risk_band": "moderate",
      "is_observed": true
    },
    {
      "entity_id": "zone_north",
      "sim_time": "2026-09-04T14:45:00Z",
      "current_count": 10756.9,
      "utilisation": 0.7684,
      "flow_rate_per_min": 87.6,
      "risk_score": 52,
      "risk_band": "moderate",
      "is_observed": true
    },
    {
      "entity_id": "zone_south",
      "sim_time": "2026-09-04T14:45:00Z",
      "current_count": 12014.3,